Regiao - Sigla;Estado - Sigla;Municipio;Revenda;CNPJ da Revenda;Nome da Rua;Numero Rua;Complemento;Bairro;Cep;Produto;Data da Coleta;Valor de Venda;Valor de Compra;Unidade de Medida;Bandeira
N;AC;CRUZEIRO DO SUL;CARDINAL E OLIVEIRA LTDA; 03.608.766/0005-75;AVENIDA BOULEVARD THAUMATURGO;1031;;CENTRO;69980-000;DIESEL;11/09/2024;7,73;;R$ / litro;VIBRA
N;AC;CRUZEIRO DO SUL;CARDINAL E OLIVEIRA LTDA; 03.608.766/0005-75;AVENIDA BOULEVARD THAUMATURGO;1031;;CENTRO;69980-000;DIESEL S10;11/09/2024;7,73;;R$ / litro;VIBRA
N;AC;CRUZEIRO DO SUL;CARDINAL E OLIVEIRA LTDA; 03.608.766/0006-56;AVENIDA 25 DE AGOSTO;1350;;25 DE AGOSTO;69980-000;DIESEL;11/09/2024;7,73;;R$ / litro;VIBRA
N;AC;CRUZEIRO DO SUL;CARDINAL E OLIVEIRA LTDA; 03.608.766/0006-56;AVENIDA 25 DE AGOSTO;1350;;25 DE AGOSTO;69980-000;DIESEL S10;11/09/2024;7,73;;R$ / litro;VIBRA
N;AC;CRUZEIRO DO SUL;AMAZONIA COMERCIO DE DERIVADOS DE PETROLEO LTDA; 01.492.748/0003-83;AVENIDA COPACABANA;440;;COPACABANA;69980-000;DIESEL;11/09/2024;7,73;;R$ / litro;IPIRANGA
N;AC;CRUZEIRO DO SUL;AMAZONIA COMERCIO DE DERIVADOS DE PETROLEO LTDA; 01.492.748/0003-83;AVENIDA COPACABANA;440;;COPACABANA;69980-000;DIESEL S10;11/09/2024;7,73;;R$ / litro;IPIRANGA
N;AC;RIO BRANCO;CODEPE COMBUSTIVEIS LTDA; 08.220.930/0001-62;RODOVIA BR-364 (RIO BRANCO-CRUZEIRO DO SUL) - ATE 2;2755;LOTE  01/02/03/04/05 E 33;PORTAL DA AMAZONIA;69915-630;DIESEL;12/09/2024;7,14;;R$ / litro;VIBRA
N;AC;RIO BRANCO;CODEPE COMBUSTIVEIS LTDA; 08.220.930/0001-62;RODOVIA BR-364 (RIO BRANCO-CRUZEIRO DO SUL) - ATE 2;2755;LOTE  01/02/03/04/05 E 33;PORTAL DA AMAZONIA;69915-630;DIESEL S10;12/09/2024;7,19;;R$ / litro;VIBRA
N;AC;RIO BRANCO;AUTO POSTO CASTANHEIRA LTDA.; 06.003.183/0001-85;ESTRADA DA FLORESTA;S/N;;FLORESTA;69906-380;DIESEL;12/09/2024;7,14;;R$ / litro;EQUADOR
N;AC;RIO BRANCO;AUTO POSTO CASTANHEIRA LTDA.; 06.003.183/0001-85;ESTRADA DA FLORESTA;S/N;;FLORESTA;69906-380;DIESEL S10;12/09/2024;7,19;;R$ / litro;EQUADOR
N;AC;RIO BRANCO;AUTO POSTO AMAPA - EIRELI; 00.529.581/0001-53;VIA CHICO MENDES;3570;;AREAL;69906-119;DIESEL;12/09/2024;7,3;;R$ / litro;VIBRA
N;AC;RIO BRANCO;POSTO VILLAGE LTDA.; 06.906.483/0001-74;RUA ANTONIO DA ROCHA VIANA;S/N;CONJ. VILLAGE W. MARCIEL QD. 02 LOTES 01 A 04;VILA IVONETE;69914-610;DIESEL;12/09/2024;7,25;;R$ / litro;VIBRA
N;AC;RIO BRANCO;POSTO VILLAGE LTDA.; 06.906.483/0001-74;RUA ANTONIO DA ROCHA VIANA;S/N;CONJ. VILLAGE W. MARCIEL QD. 02 LOTES 01 A 04;VILA IVONETE;69914-610;DIESEL S10;12/09/2024;7,29;;R$ / litro;VIBRA
N;AC;RIO BRANCO;AUTO POSTO CIDADE LTDA; 06.321.359/0001-47;AVENIDA NACOES UNIDAS;2123;;7 BEC;69918-093;DIESEL;12/09/2024;7,25;;R$ / litro;VIBRA
N;AC;RIO BRANCO;AUTO POSTO CIDADE LTDA; 06.321.359/0001-47;AVENIDA NACOES UNIDAS;2123;;7 BEC;69918-093;DIESEL S10;12/09/2024;7,29;;R$ / litro;VIBRA
N;AC;RIO BRANCO;AUTO POSTO SANTO ANTONIO LTDA; 14.412.076/0001-39;RUA ISAURA PARENTE;3265;;EST EXPERIMENTAL;69908-210;DIESEL;10/09/2024;7,25;;R$ / litro;VIBRA
N;AC;RIO BRANCO;AUTO POSTO SANTO ANTONIO LTDA; 14.412.076/0001-39;RUA ISAURA PARENTE;3265;;EST EXPERIMENTAL;69908-210;DIESEL S10;10/09/2024;7,29;;R$ / litro;VIBRA
N;AC;RIO BRANCO;POSTO FLORESTA E AGROPECUARIA LTDA; 04.767.269/0001-59;ESTRADA DA FLORESTA;684;;FLORESTA;69906-380;DIESEL;12/09/2024;7,14;;R$ / litro;VIBRA
N;AC;RIO BRANCO;POSTO FLORESTA E AGROPECUARIA LTDA; 04.767.269/0001-59;ESTRADA DA FLORESTA;684;;FLORESTA;69906-380;DIESEL S10;12/09/2024;7,19;;R$ / litro;VIBRA
NE;AL;ARAPIRACA;AUTO POSTO M M GARROTE LTDA; 08.738.994/0001-50;RODOVIA AL-220;5848;KM    96;BOM SUCESSO;57309-035;DIESEL S10;09/09/2024;6,09;;R$ / litro;VIBRA
NE;AL;ARAPIRACA;POSTO ARAPIRACA LTDA; 12.451.076/0001-12;RUA EXPEDICIONARIOS BRASILEIROS;252;;CENTRO;57300-590;DIESEL S10;09/09/2024;5,99;;R$ / litro;VIBRA
NE;AL;ARAPIRACA;AUTO POSTO MASSARANDUBA LTDA.; 07.248.398/0001-29;RODOVIA AL 220;4698;;PLANALTO;57308-000;DIESEL;09/09/2024;5,98;;R$ / litro;BRANCA
NE;AL;ARAPIRACA;DISTRIBUIDORA DE VEICULOS CONFIANCA LIMITADA; 12.396.339/0001-38;RUA QUINZE DE NOVEMBRO;451;;BRASILIA;57313-015;DIESEL S10;10/09/2024;6,09;;R$ / litro;RAIZEN
NE;AL;ARAPIRACA;IBN PINTO E SILVA & CIA LTDA; 01.242.690/0001-58;RODOVIA AL-110;678;KM    70;CANAFISTULA;57302-802;GNV;09/09/2024;4,99;;R$ / m³;BRANCA
NE;AL;ARAPIRACA;IBN PINTO E SILVA & CIA LTDA; 01.242.690/0001-58;RODOVIA AL-110;678;KM    70;CANAFISTULA;57302-802;DIESEL S10;09/09/2024;5,89;;R$ / litro;BRANCA
NE;AL;ARAPIRACA;IBN PINTO E SILVA & CIA LTDA; 01.242.690/0002-39;AVENIDA EMIDIO DE LIMA,;23;;JARDIM ESPERANCA;57307-350;GNV;09/09/2024;4,99;;R$ / m³;IPIRANGA
NE;AL;ARAPIRACA;IBN PINTO E SILVA & CIA LTDA; 01.242.690/0002-39;AVENIDA EMIDIO DE LIMA,;23;;JARDIM ESPERANCA;57307-350;DIESEL S10;09/09/2024;6,14;;R$ / litro;IPIRANGA
NE;AL;DELMIRO GOUVEIA;AUTO POSTO FREITAS & MAIA LTDA; 12.436.978/0001-80;RUA FLORIANO PEIXOTO;247;;CENTRO;57480-000;DIESEL S10;10/09/2024;6,78;;R$ / litro;VIBRA
NE;AL;DELMIRO GOUVEIA;AUTO POSTO DA PEDRA LTDA; 05.518.639/0001-87;RUA FLORIANO PEIXOTO;281;;CENTRO;57480-000;DIESEL;10/09/2024;6,78;;R$ / litro;VIBRA
NE;AL;DELMIRO GOUVEIA;AUTO POSTO DA PEDRA LTDA; 05.518.639/0001-87;RUA FLORIANO PEIXOTO;281;;CENTRO;57480-000;DIESEL S10;10/09/2024;6,83;;R$ / litro;VIBRA
NE;AL;DELMIRO GOUVEIA;COMERCIO DE COMBUSTIVEIS NENZITA LTDA; 04.431.113/0001-00;AVENIDA CAXANGA;126;;PEDRA VELHA;57480-000;DIESEL;09/09/2024;6,7;;R$ / litro;BRANCA
NE;AL;DELMIRO GOUVEIA;COMERCIO DE COMBUSTIVEIS NENZITA LTDA; 04.431.113/0001-00;AVENIDA CAXANGA;126;;PEDRA VELHA;57480-000;DIESEL S10;09/09/2024;6,74;;R$ / litro;BRANCA
NE;AL;RIO LARGO;CDA EMPREENDIMENTOS LTDA; 12.486.809/0004-05;RODOVIA BR 104 AL. KM 86;SN;;MATA DO ROLO;57100-000;GNV;09/09/2024;4,99;;R$ / m³;VIBRA
NE;AL;RIO LARGO;OLIVEIRA & FREITAS LTDA; 01.600.494/0001-08;LOTEAMENTO VILA RICA;S/N;LOTE  12                  QUADRAB;MATA DO ROLO;57100-000;DIESEL S10;09/09/2024;6,29;;R$ / litro;IPIRANGA
NE;AL;RIO LARGO;AUTO POSTO FORENE LTDA; 05.459.764/0001-63;LOTEAMENTO SAO CAETANO;SN;LOTE  05 E 06             QUADRAF;PREFEITO ANTONIO LINS DE SOUZA;57100-000;GNV;09/09/2024;4,99;;R$ / m³;VIBRA
NE;AL;RIO LARGO;AUTO POSTO PIONEIRO LTDA; 05.101.388/0001-30;RODOVIA BR 101 NORTE KM 75;S/N;ZONA RURAL;ZONA RURAL;57100-000;DIESEL S10;09/09/2024;5,89;;R$ / litro;VIBRA
N;AM;PARINTINS;F.J. COMERCIO DE COMBUSTIVEIS LTDA; 09.368.602/0001-70;RUA PARAIBA;41;CONJ  MACURANY;RAIMUNDO MUNIZ;69151-456;DIESEL S10;12/09/2024;7,39;;R$ / litro;BRANCA
N;AP;MACAPA;POSTO ICCAR LTDA; 02.280.133/0034-52;AVENIDA RIO VILA NOVA;62;ESQ. C/RUA BEIRA RIO;TREM;68905-160;DIESEL S10;10/09/2024;6,13;;R$ / litro;BRANCA
N;AP;MACAPA;SEPE TIARAJU EMPREENDIMENTOS LTDA; 05.297.501/0002-86;RUA SETENTRIONAL;S/N;ESQUINA COM BEIRA RIO;ARAXÁ;68903-640;DIESEL;10/09/2024;6,31;;R$ / litro;BRANCA
N;AP;MACAPA;SEPE TIARAJU EMPREENDIMENTOS LTDA; 05.297.501/0002-86;RUA SETENTRIONAL;S/N;ESQUINA COM BEIRA RIO;ARAXÁ;68903-640;DIESEL S10;10/09/2024;6,32;;R$ / litro;BRANCA
N;AP;MACAPA;AUTO POSTO TERCEIRO MILÊNIO LTDA; 03.199.834/0001-66;RUA MATO GROSSO;430;;PACOVAL;68900-000;DIESEL;10/09/2024;7,32;;R$ / litro;VIBRA
N;AP;MACAPA;AUTO POSTO TERCEIRO MILÊNIO LTDA; 03.199.834/0001-66;RUA MATO GROSSO;430;;PACOVAL;68900-000;DIESEL S10;10/09/2024;7,89;;R$ / litro;VIBRA
NE;BA;ALAGOINHAS;RPMP COMERCIO DE COMBUSTIVEIS LTDA; 06.041.306/0002-53;AVENIDA JURACY MAGALHAES;S/N;;CENTRO;48005-440;DIESEL;10/09/2024;5,52;;R$ / litro;BRANCA
NE;BA;ALAGOINHAS;RPMP COMERCIO DE COMBUSTIVEIS LTDA; 06.041.306/0002-53;AVENIDA JURACY MAGALHAES;S/N;;CENTRO;48005-440;DIESEL S10;10/09/2024;5,62;;R$ / litro;BRANCA
NE;BA;ALAGOINHAS;CPD ENERGETICOS E DERIVADOS DE PETROLEO LTDA.; 08.359.486/0001-60;RODOVIA BR 101, KM 110,5;S/N;;ZONA RURAL;48010-970;GNV;10/09/2024;4,39;;R$ / m³;VIBRA
NE;BA;ALAGOINHAS;CPD ENERGETICOS E DERIVADOS DE PETROLEO LTDA.; 08.359.486/0001-60;RODOVIA BR 101, KM 110,5;S/N;;ZONA RURAL;48010-970;DIESEL;10/09/2024;5,56;;R$ / litro;VIBRA
NE;BA;ALAGOINHAS;CPD ENERGETICOS E DERIVADOS DE PETROLEO LTDA.; 08.359.486/0001-60;RODOVIA BR 101, KM 110,5;S/N;;ZONA RURAL;48010-970;DIESEL S10;10/09/2024;5,66;;R$ / litro;VIBRA
NE;BA;ALAGOINHAS;POSTO TROPICAL DE COMBUSTIVEIS LTDA; 04.218.516/0001-68;RUA PAULO AFONSO;420;;PRACA KENNEDY;48020-650;DIESEL;10/09/2024;5,88;;R$ / litro;BRANCA
NE;BA;ALAGOINHAS;POSTO TROPICAL DE COMBUSTIVEIS LTDA; 04.218.516/0001-68;RUA PAULO AFONSO;420;;PRACA KENNEDY;48020-650;DIESEL S10;10/09/2024;5,98;;R$ / litro;BRANCA
NE;BA;ALAGOINHAS;DALILA DERIVADOS DE PETROLEO LTDA; 03.990.964/0001-12;RUA CONSELHEIRO JUNQUEIRA;SN;;CENTRO;48090-021;DIESEL;10/09/2024;5,56;;R$ / litro;PETROBAHIA
NE;BA;ALAGOINHAS;DALILA DERIVADOS DE PETROLEO LTDA; 03.990.964/0001-12;RUA CONSELHEIRO JUNQUEIRA;SN;;CENTRO;48090-021;DIESEL S10;10/09/2024;5,64;;R$ / litro;PETROBAHIA
NE;BA;BARREIRAS;SANDRA REGINA COMBUSTIVEIS LTDA; 03.131.522/0001-10;AVENIDA ANTONIO CARLOS MAGALHAES;606;;JARDIM OURO BRANCO;47802-147;DIESEL;11/09/2024;6,2;;R$ / litro;LARCO
NE;BA;BARREIRAS;SANDRA REGINA COMBUSTIVEIS LTDA; 03.131.522/0001-10;AVENIDA ANTONIO CARLOS MAGALHAES;606;;JARDIM OURO BRANCO;47802-147;DIESEL S10;11/09/2024;6,3;;R$ / litro;LARCO
NE;BA;BARREIRAS;DT COMBUSTIVEIS LTDA; 08.546.610/0001-05;AVENIDA ANTONIO CARLOS MAGALHAES;2024;;NOVO HORIZONTE;47802-366;DIESEL;11/09/2024;6,2;;R$ / litro;LARCO
NE;BA;BARREIRAS;DT COMBUSTIVEIS LTDA; 08.546.610/0001-05;AVENIDA ANTONIO CARLOS MAGALHAES;2024;;NOVO HORIZONTE;47802-366;DIESEL S10;11/09/2024;6,3;;R$ / litro;LARCO
NE;BA;BARREIRAS;SABBA COMBUSTIVEIS LTDA; 01.664.891/0001-43;RUA SAO BERNARDO;35;;VILA DOS SAS;47810-760;DIESEL;11/09/2024;6,35;;R$ / litro;RAIZEN
NE;BA;ILHEUS;CHECON DANTAS COMERCIO DE COMBUSTIVEIS LTDA; 09.166.195/0001-19;AVENIDA ITABUNA;534;;CENTRO;45653-160;DIESEL S10;10/09/2024;6,69;;R$ / litro;RAIZEN
NE;BA;ILHEUS;DERIVADOS DE PETROLEO LELEU LTDA; 13.497.953/0001-59;AVENIDA ITABUNA;2282;;CENTRO;45653-160;DIESEL;10/09/2024;6,69;;R$ / litro;IPIRANGA
NE;BA;ILHEUS;COMERCIAL SAVOIA LTDA; 02.366.787/0001-35;AVENIDA RAYMUNDO SA BARRETO;S/N;LOTES 26 27 E 28;JARDIM SAVOIA;45658-250;DIESEL S10;10/09/2024;6,57;;R$ / litro;BRANCA
NE;BA;ILHEUS;AM DERIVADOS DE PETROLEO E COMERCIO LTDA; 00.175.819/0001-90;AVENIDA PETROBRAS;100;TERREO;CENTRO;45652-155;DIESEL S10;10/09/2024;6,69;;R$ / litro;IPIRANGA
NE;BA;IPIRA;A S VIANA COSTA DANTAS; 02.448.248/0001-45;SITIO SAO JOSE;SN;;SEDE;44600-000;DIESEL;12/09/2024;6,5;;R$ / litro;ALE
NE;BA;IPIRA;A S VIANA COSTA DANTAS; 02.448.248/0001-45;SITIO SAO JOSE;SN;;SEDE;44600-000;DIESEL S10;12/09/2024;6,55;;R$ / litro;ALE
NE;BA;ITABUNA;COMERCIAL HUSSEL ITABUNA I LTDA; 05.117.524/0001-80;AVENIDA MANOEL CHAVES;500;LT.JD.CORDIER L. 8/13;JACANA;45608-401;DIESEL;09/09/2024;5,65;;R$ / litro;BRANCA
NE;BA;ITABUNA;COMERCIAL HUSSEL ITABUNA I LTDA; 05.117.524/0001-80;AVENIDA MANOEL CHAVES;500;LT.JD.CORDIER L. 8/13;JACANA;45608-401;DIESEL S10;09/09/2024;5,78;;R$ / litro;BRANCA
NE;BA;ITABUNA;IC PEREIRA COMERCIO DE  DERIVADOS DE PETROLEO LTDA; 04.028.011/0001-30;AVENIDA FERNANDO GOMES OLIVEIRA;SN;;CENTRO;45600-107;DIESEL S10;12/09/2024;5,82;;R$ / litro;RAIZEN
NE;BA;ITABUNA;DERIVADOS DE PETROLEO E SERVICOS LTDA; 14.345.573/0001-61;AVENIDA JOSE SOARES PINHEIRO;2261;TERREO;LOMANTO JUNIOR;45601-051;DIESEL;12/09/2024;5,71;;R$ / litro;BRANCA
NE;BA;ITABUNA;DERIVADOS DE PETROLEO E SERVICOS LTDA; 14.345.573/0001-61;AVENIDA JOSE SOARES PINHEIRO;2261;TERREO;LOMANTO JUNIOR;45601-051;DIESEL S10;12/09/2024;5,82;;R$ / litro;BRANCA
NE;BA;ITABUNA;DERIVADOS DE PETROLEO TEUNA LTDA; 13.056.270/0001-66;AVENIDA INACIO TOSTA FILHO;834;;CENTRO;45600-201;DIESEL S10;12/09/2024;5,82;;R$ / litro;BRANCA
NE;BA;ITABUNA;POSTO UNIVERSAL COMÉRCIO DE COMBUSTÍVEIS LTDA; 03.340.439/0001-51;RUA MARIA OLIVIA REBOUÇAS;S/N;;CENTRO;45600-000;DIESEL S10;12/09/2024;5,82;;R$ / litro;VIBRA
NE;BA;ITAMARAJU;CODEPEL -COMERCIO DE DERIVADOS DE PETROLEO LTDA; 05.696.709/0001-97;AVENIDA PERIMENRAL;348;TERREO;CENTRO;45836-000;DIESEL;10/09/2024;5,89;;R$ / litro;BRANCA
NE;BA;ITAMARAJU;CODEPEL -COMERCIO DE DERIVADOS DE PETROLEO LTDA; 05.696.709/0001-97;AVENIDA PERIMENRAL;348;TERREO;CENTRO;45836-000;DIESEL S10;10/09/2024;5,99;;R$ / litro;BRANCA
NE;BA;ITAMARAJU;BENTIVI DERIVADOS DE PETROLEO LTDA; 13.683.818/0001-06;RODOVIA BR 101;S/N;KM 808;SEDE;45836-000;DIESEL;10/09/2024;5,97;;R$ / litro;IPIRANGA
NE;BA;ITAMARAJU;BENTIVI DERIVADOS DE PETROLEO LTDA; 13.683.818/0001-06;RODOVIA BR 101;S/N;KM 808;SEDE;45836-000;DIESEL S10;10/09/2024;6,04;;R$ / litro;IPIRANGA
NE;BA;JACOBINA;TROPICAL COMBUSTIVEIS E LUBRIFICANTES LTDA; 07.856.330/0001-22;RUA FRANCISCO ROCHA PIRES;300;;CENTRO;44700-000;DIESEL S10;10/09/2024;6,13;;R$ / litro;BRANCA
NE;BA;JEQUIE;SS COMERCIO DERIVADOS DE PETROLEO LTDA; 08.505.094/0001-62;RUA BERTINO PASSOS;250;;CENTRO;45202-340;DIESEL;10/09/2024;6,09;;R$ / litro;BRANCA
NE;BA;JEQUIE;SS COMERCIO DERIVADOS DE PETROLEO LTDA; 08.505.094/0001-62;RUA BERTINO PASSOS;250;;CENTRO;45202-340;DIESEL S10;10/09/2024;6,19;;R$ / litro;BRANCA
NE;BA;JEQUIE;D & M COMERCIAL LTDA; 03.550.965/0001-46;AVENIDA JOAO GOULART;65;;CENTRO;45200-070;DIESEL;10/09/2024;6,3;;R$ / litro;RAIZEN
NE;BA;JEQUIE;D & M COMERCIAL LTDA; 03.550.965/0001-46;AVENIDA JOAO GOULART;65;;CENTRO;45200-070;DIESEL S10;10/09/2024;6,4;;R$ / litro;RAIZEN
NE;BA;JEQUIE;JEQUIEZINHO COMERCIO VAREJISTA DE COMBUSTIVEIS LTDA; 05.924.835/0001-51;RUA DR. JOAO BRAGA;S/N;;JEQUIEZINHO;45205-011;DIESEL;10/09/2024;5,54;;R$ / litro;BRANCA
NE;BA;JEQUIE;PITU COMERCIO DE DERIVADOS DE PETROLEO LTDA; 02.891.624/0001-71;AVENIDA GOVERNADOR LOMANTO JUNIOR;220;;CENTRO;45202-130;DIESEL S10;10/09/2024;5,89;;R$ / litro;BRANCA
NE;BA;JEQUIE;M W COMERCIO DE COMBUSTIVEIS SERVICOS E ALIMENTOS LTDA; 00.697.413/0001-77;PRACA GOVERNADOR JURACY MAGALHAES;437A;;JEQUIEZINHO;45208-109;DIESEL;10/09/2024;6,09;;R$ / litro;BRANCA
NE;BA;JEQUIE;M W COMERCIO DE COMBUSTIVEIS SERVICOS E ALIMENTOS LTDA; 00.697.413/0001-77;PRACA GOVERNADOR JURACY MAGALHAES;437A;;JEQUIEZINHO;45208-109;DIESEL S10;10/09/2024;6,19;;R$ / litro;BRANCA
NE;BA;JEQUIE;SUDOESTE COMÉRCIO DE COMBUSTÍVEIS & SERVIÇOS LTDA.; 00.296.696/0001-45;AVENIDA OTAVIO MANGABEIRA;S/N;;MANDACARU;45200-000;DIESEL;10/09/2024;6,09;;R$ / litro;IPIRANGA
NE;BA;JEQUIE;SUDOESTE COMÉRCIO DE COMBUSTÍVEIS & SERVIÇOS LTDA.; 00.296.696/0001-45;AVENIDA OTAVIO MANGABEIRA;S/N;;MANDACARU;45200-000;DIESEL S10;10/09/2024;6,19;;R$ / litro;IPIRANGA
NE;BA;POCOES;QUEIROZ SANTOS COMÉRCIO DE COMBUSTIVEL LTDA; 07.183.283/0001-01;RUA GERMANO BATISTA DE SOUZA;320;;PITUBA;45260-000;DIESEL;10/09/2024;5,74;;R$ / litro;BRANCA
NE;BA;POCOES;R.R. COMERCIO VAREJISTA E TRANSPORTE DE DERIVADOS DE PETROLEO LTDA; 06.165.285/0001-05;RUA TIMOTEO GONCALVES DA COSTA;79;;CENTRO;45260-000;DIESEL;09/09/2024;5,74;;R$ / litro;BRANCA
NE;BA;POCOES;POCOES DERIVADOS DE PETROLEO LTDA; 05.799.060/0001-30;RUA VIRGILIO DAMASIO;1;;LAGOA GRANDE;45260-000;DIESEL;10/09/2024;5,74;;R$ / litro;BRANCA
NE;BA;POCOES;POCOES DERIVADOS DE PETROLEO LTDA; 05.799.060/0001-30;RUA VIRGILIO DAMASIO;1;;LAGOA GRANDE;45260-000;DIESEL S10;10/09/2024;5,84;;R$ / litro;BRANCA
NE;BA;POCOES;POSTO E HOTEL PITUBA LTDA; 14.986.103/0001-87;RODOVIA BR 116;S/N;KM    766,620;SEDE;45260-000;DIESEL;10/09/2024;5,59;;R$ / litro;BRANCA
NE;BA;POCOES;POSTO E HOTEL PITUBA LTDA; 14.986.103/0001-87;RODOVIA BR 116;S/N;KM    766,620;SEDE;45260-000;DIESEL S10;10/09/2024;5,69;;R$ / litro;BRANCA
NE;BA;POCOES;AUTO POSTO REFORCO LTDA; 13.315.486/0001-07;AVENIDA PRESIDENTE JUSCELINO KUBITSCHEK;754;RODOVIA BR 116            KM 758;PITUBA;45260-000;DIESEL;10/09/2024;5,59;;R$ / litro;VIBRA
NE;BA;POCOES;AUTO POSTO REFORCO LTDA; 13.315.486/0001-07;AVENIDA PRESIDENTE JUSCELINO KUBITSCHEK;754;RODOVIA BR 116            KM 758;PITUBA;45260-000;DIESEL S10;10/09/2024;5,69;;R$ / litro;VIBRA
NE;BA;SALVADOR;ECOPOSTOS - COMBUSTIVEIS E SERVICOS LTDA; 04.420.464/0004-50;AVENIDA BARROS REIS - LADO PAR;2938;ARRAIAL DO RETIRO;ARRAIAL DO RETIRO;41204-025;GNV;09/09/2024;4,38;;R$ / m³;VIBRA
NE;BA;SALVADOR;DEUSNEI - COMERCIO DE COMBUSTIVEIS E LUBRIFICANTES LTDA; 08.378.412/0001-71;AVENIDA DORIVAL  CAYMMI;17336;;SAO  CRISTOVAO;41635-150;DIESEL S10;10/09/2024;6,39;;R$ / litro;VIBRA
NE;BA;SALVADOR;J&J COMBUSTIVEIS LTDA; 06.115.130/0001-56;AVENIDA ANTONIO CARLOS MAGALHAES;5863;;SANTA TERESA;40265-200;GNV;09/09/2024;4,39;;R$ / m³;IPIRANGA
NE;BA;SALVADOR;PACIFICO COMERCIO E SERVICOS DE COMBUSTIVEIS LTDA; 06.948.623/0001-77;AVENIDA SANTA LUZIA;1137;;HORTO FLORESTAL;40295-050;DIESEL S10;09/09/2024;6,48;;R$ / litro;VIBRA
NE;BA;SALVADOR;AUTO POSTO CAMURUPIM LTDA; 06.895.357/0001-61;AVENIDA OCTAVIO MANGABEIRA;429;;PITUBA;41830-050;DIESEL S10;09/09/2024;5,88;;R$ / litro;RAIZEN
NE;BA;SALVADOR;POSTO KALILANDIA LTDA; 15.151.046/0012-31;AVENIDA LUIS VIANA;2489;;PERNAMBUES;41130-530;GNV;10/09/2024;4,39;;R$ / m³;RAIZEN
NE;BA;SALVADOR;POSTO KALILANDIA LTDA; 15.151.046/0012-31;AVENIDA LUIS VIANA;2489;;PERNAMBUES;41130-530;DIESEL S10;10/09/2024;5,89;;R$ / litro;RAIZEN
NE;BA;SALVADOR;POSTO KALILANDIA LTDA; 15.151.046/0004-21;AVENIDA AVENIDA OCTAVIO MANGABEIRA;S/N;JARDIM PLACAFORD;ITAPOAN;41612-040;DIESEL S10;10/09/2024;5,89;;R$ / litro;VIBRA
NE;BA;SALVADOR;D & B COMERCIAL LTDA; 05.548.976/0001-17;AVENIDA PROFESSOR PINTO DE AGUIAR;2100;;PITUACU;41740-090;DIESEL S10;10/09/2024;6,59;;R$ / litro;RAIZEN
NE;BA;SALVADOR;GAS ON LINE COMERCIO E SERVICOS LTDA; 05.033.611/0001-50;AVENIDA HEITOR DIAS;735;;PAU MIUDO;40315-518;GNV;09/09/2024;4,38;;R$ / m³;LARCO
NE;BA;SALVADOR;GAS ON LINE COMERCIO E SERVICOS LTDA; 05.033.611/0001-50;AVENIDA HEITOR DIAS;735;;PAU MIUDO;40315-518;DIESEL S10;09/09/2024;6,17;;R$ / litro;LARCO
NE;BA;SALVADOR;POSTO GAMELEIRA LTDA; 13.570.353/0001-79;RODOVIA RODOVIA BR 324, KM 9,5;S/N;POSTO;PIRAJA;40301-155;GNV;11/09/2024;4,38;;R$ / m³;VIBRA
NE;BA;SALVADOR;POSTO GAMELEIRA LTDA; 13.570.353/0001-79;RODOVIA RODOVIA BR 324, KM 9,5;S/N;POSTO;PIRAJA;40301-155;DIESEL S10;11/09/2024;5,99;;R$ / litro;VIBRA
NE;BA;SALVADOR;AUTO POSTO BUDIÃO LTDA.; 13.635.461/0001-82;RUA DOUTOR AUGUSTO LOPES PONTES;167;;COSTA AZUL;41760-035;DIESEL S10;10/09/2024;5,83;;R$ / litro;RAIZEN
NE;BA;SALVADOR;J A SOBRAL & CIA LTDA; 13.799.101/0001-16;AVENIDA MARIO LEAL FERREIRA;509;;BONOCO;40252-390;DIESEL S10;10/09/2024;6,39;;R$ / litro;VIBRA
NE;BA;SALVADOR;POSTO DE LUBRIFICACAO BARBALHO LTDA; 15.135.429/0001-63;LADEIRA DO ARCO;88;;BARBALHO;40301-146;DIESEL S10;09/09/2024;6,18;;R$ / litro;VIBRA
NE;BA;SALVADOR;POSTO INDEPENDENCIA DE LUBRIFICACAO LTDA; 15.127.988/0001-21;LADEIRA DA INDEPENDENCIA;173;;NAZARE;40040-340;DIESEL S10;09/09/2024;6,49;;R$ / litro;IPIRANGA
NE;BA;SALVADOR;POSTOS MATARIPE ABASTECIMENTOS E SERVICOS LTDA; 13.578.265/0001-13;AVENIDA MARIO LEAL FERREIRA;2230;VALE DO BONOCO;BROTAS;40285-600;GNV;10/09/2024;4,39;;R$ / m³;VIBRA
NE;BA;SALVADOR;POSTO UP3 COMERCIO DE COMBUSTIVEIS E LUBRIFICANTES LTDA; 04.906.594/0001-55;AVENIDA VASCO DA GAMA;1894;;FEDERACAO;40230-731;DIESEL S10;09/09/2024;5,79;;R$ / litro;RAIZEN
NE;BA;SALVADOR;POSTO DE GASOLINA FELICI LTDA; 00.138.957/0001-07;AVENIDA PRESIDENTE CASTELO BRANCO;SN;;SAUDE;40045-050;DIESEL S10;09/09/2024;5,89;;R$ / litro;VIBRA
NE;BA;SALVADOR;POSTO 4 COMERCIO DE COMBUSTIVEIS LTDA; 00.062.382/0004-20;AVENIDA CARDEAL AVELAR BRANDAO VILELA;2505;;MATA ESCURA;41110-000;DIESEL;11/09/2024;5,76;;R$ / litro;BRANCA
NE;BA;SALVADOR;POSTO 4 COMERCIO DE COMBUSTIVEIS LTDA; 00.062.382/0004-20;AVENIDA CARDEAL AVELAR BRANDAO VILELA;2505;;MATA ESCURA;41110-000;DIESEL S10;11/09/2024;5,78;;R$ / litro;BRANCA
NE;BA;VALENCA;IDVALDO MONTEIRO & FILHOS LTDA; 03.867.369/0001-94;RUA DA AGUAZINHA;153;;CENTRO;45400-000;DIESEL;10/09/2024;5,95;;R$ / litro;LARCO
NE;BA;VALENCA;IDVALDO MONTEIRO & FILHOS LTDA; 03.867.369/0001-94;RUA DA AGUAZINHA;153;;CENTRO;45400-000;DIESEL S10;10/09/2024;5,99;;R$ / litro;LARCO
NE;BA;VALENCA;AZULAO COMERCIO DE COMBUSTIVEIS EIRELI; 03.258.218/0001-39;RODOVIA BA 001;S/N;KM 0(ZERO);TRECHO VAL/TAPEROA;45400-000;DIESEL S10;10/09/2024;5,97;;R$ / litro;BRANCA
NE;BA;VALENCA;ORGANIZACAO GUAIBIM LTDA; 01.878.111/0001-68;AVENIDA ANTONIO CARLOS MAGALHAES;500;;SÃO FELIX;45400-000;DIESEL;10/09/2024;5,95;;R$ / litro;BRANCA
NE;BA;VALENCA;ORGANIZACAO GUAIBIM LTDA; 01.878.111/0001-68;AVENIDA ANTONIO CARLOS MAGALHAES;500;;SÃO FELIX;45400-000;DIESEL S10;10/09/2024;5,99;;R$ / litro;BRANCA
NE;CE;ICO;COMERCIAL DE PETROLEO PARAIBANO LTDA; 05.483.270/0001-14;AVENIDA MONSENHOR FROTA;673;;NOVO CENTRO;63430-000;DIESEL;12/09/2024;6,16;;R$ / litro;BRANCA
NE;CE;ICO;COMERCIAL DE PETROLEO PARAIBANO LTDA; 05.483.270/0001-14;AVENIDA MONSENHOR FROTA;673;;NOVO CENTRO;63430-000;DIESEL S10;12/09/2024;6,29;;R$ / litro;BRANCA
NE;CE;ICO;POSTO DE COMBUSTIVEIS SENHORA SANTANA I- EIRELI; 04.931.921/0001-29;AVENIDA JOSEFA NOGUEIRA MONTEIRO;1681;TERREO;CENTRO;63430-000;DIESEL;12/09/2024;6,49;;R$ / litro;BRANCA
NE;CE;ICO;POSTO DE COMBUSTIVEIS SENHORA SANTANA I- EIRELI; 04.931.921/0001-29;AVENIDA JOSEFA NOGUEIRA MONTEIRO;1681;TERREO;CENTRO;63430-000;DIESEL S10;12/09/2024;6,49;;R$ / litro;BRANCA
NE;CE;LIMOEIRO DO NORTE;NOVO TEMPO COMERCIO DE COMBUSTIVEIS LTDA; 08.077.231/0001-05;RUA SABINO ROBERTO DE FREITAS;2889;;CENTRO;62930-000;DIESEL S10;11/09/2024;6,39;;R$ / litro;BRANCA
NE;CE;LIMOEIRO DO NORTE;BEZERRA E FILHO LTDA; 05.267.406/0002-30;AVENIDA DOM AURELIANO MATOS;2110;;CENTRO;62930-000;DIESEL S10;11/09/2024;6,19;;R$ / litro;BRANCA
NE;CE;LIMOEIRO DO NORTE;GURGEL LOBO COMERCIO DE DERIVADOS DE PETROLEO LTDA; 02.479.591/0001-57;RUA CEL. ANTONIO JOAQUIM;1060;;CENTRO;62930-000;DIESEL;11/09/2024;6,39;;R$ / litro;BRANCA
NE;CE;LIMOEIRO DO NORTE;GURGEL LOBO COMERCIO DE DERIVADOS DE PETROLEO LTDA; 02.479.591/0001-57;RUA CEL. ANTONIO JOAQUIM;1060;;CENTRO;62930-000;DIESEL S10;11/09/2024;6,39;;R$ / litro;BRANCA
NE;CE;SOBRAL;ECONOGÁS DO BRASIL DIST. DERIV. DE PET. BIOC. E GÁS NAT; 08.775.979/0002-62;RUA TABELIÃO IDELFONSO CAVALCANTI;455;;CENTRO;62010-000;DIESEL S10;12/09/2024;6,36;;R$ / litro;RAIZEN
NE;CE;SOBRAL;T. C. DE VASCONCELOS & CIA LTDA; 07.380.155/0002-20;AVENIDA CEL. JOSE EUCLIDES FERREIRA GOMES;970;;EXPECTATIVA;62040-254;DIESEL S10;12/09/2024;6,39;;R$ / litro;VIBRA
NE;CE;SOBRAL;AUTO POSTO PIONEIRO LTDA; 07.428.286/0001-50;AVENIDA JOHN SANFORD;704;;JUNCO;62030-000;DIESEL S10;12/09/2024;6,39;;R$ / litro;VIBRA
NE;CE;SOBRAL;V.C.EMPREENDIMENTOS LTDA; 03.551.935/0002-35;AVENIDA JOSE EUCLIDES FERREIRA GOMES;30;POSTO FLASH;CORACAO DE JESUS;62043-070;DIESEL S10;12/09/2024;6,38;;R$ / litro;RAIZEN
NE;CE;SOBRAL;COMERCIAL DE COMBUSTIVEIS TREZE DE MAIO LTDA; 05.980.738/0001-86;AVENIDA JONH SANFORD;1943;;JUNCO;62114-000;DIESEL S10;12/09/2024;6,39;;R$ / litro;BRANCA
NE;CE;SOBRAL;CENTER POSTO COMERCIAL LTDA; 02.905.892/0001-03;AVENIDA JOSE ARIMATEIA MONTE E SILVA;425;;CAMPOS DOS VELHOS;62114-000;DIESEL S10;12/09/2024;6,39;;R$ / litro;VIBRA
NE;CE;SOBRAL;POSTO PRINCESA DO NORTE LTDA; 01.914.855/0001-90;RUA MENINO DEUS;691;;CENTRO;62010-310;DIESEL S10;12/09/2024;6,39;;R$ / litro;IPIRANGA
NE;CE;SOBRAL;GLORIMAR PETROLEO E LUBRIFICANTES LTDA; 01.488.905/0001-15;AVENIDA DOM JOSE;1449;;CENTRO;62010-290;DIESEL S10;12/09/2024;6,38;;R$ / litro;RAIZEN
CO;DF;BRASILIA;DRIVE CAR TRANSPORTES E COMBUSTIVEIS LTDA; 00.012.211/0003-06;AREA ESPECIAL PLLR;1;SLC;GAMA;72460-000;DIESEL S10;09/09/2024;5,79;;R$ / litro;RAIZEN
CO;DF;BRASILIA;CASCOL COMBUSTIVEIS PARA VEICULOS LTDA; 00.306.597/0015-00;QUADRA QR 516 CONJUNTO 13B LOTE LOTE;1;;SAMAMBAIA SUL;70772-500;DIESEL S10;11/09/2024;5,98;;R$ / litro;BRANCA
CO;DF;BRASILIA;BRASAL COMBUSTIVEIS LTDA; 00.097.626/0001-68;SETOR SIA Quadra 2-C;S/N;LOTE  01;ZONA INDUSTRIAL (GUARA);71200-025;DIESEL;09/09/2024;5,99;;R$ / litro;RAIZEN
CO;DF;BRASILIA;BRASAL COMBUSTIVEIS LTDA; 00.097.626/0001-68;SETOR SIA Quadra 2-C;S/N;LOTE  01;ZONA INDUSTRIAL (GUARA);71200-025;DIESEL S10;09/09/2024;5,99;;R$ / litro;RAIZEN
CO;DF;BRASILIA;M L SOUZA & CIA LTDA; 00.005.892/0001-13;QUADRA C 6;S/N;LOTE  01/02;TAGUATINGA CENTRO (TAGUATINGA);72010-060;DIESEL;09/09/2024;5,69;;R$ / litro;TOTALENERGIES
SE;ES;LINHARES;AUTO SERVICO FLORESTA LTDA; 05.609.081/0001-45;AVENIDA PREFEITO SAMUEL BATISTA CRUZ;1276;;ARACA;29900-100;DIESEL;10/09/2024;5,89;;R$ / litro;VIBRA
SE;ES;LINHARES;POSTO VIENA LTDA - ME; 04.008.437/0001-22;AVENIDA PREFEITO SAMUEL BATISTA CRUZ;3764;;NOVO HORIZONTE;29902-101;DIESEL S10;10/09/2024;5,99;;R$ / litro;RAIZEN
SE;ES;LINHARES;POSTO OURO NEGRO LTDA; 02.468.894/0001-74;AVENIDA SAMUEL BATISTA CRUZ;2319;;COLINA;29901-401;GNV;10/09/2024;4,69;;R$ / m³;VIBRA
SE;ES;SAO MATEUS;POSTO SD LTDA.; 00.762.780/0002-98;AVENIDA GURIRI;154;;GURIRI;29930-000;DIESEL S10;11/09/2024;6,09;;R$ / litro;VIBRA
SE;ES;SAO MATEUS;POSTO DAMIANI LTDA.; 03.348.196/0001-06;AVENIDA CENTRAL;567;;CARAPINA;29933-210;DIESEL;11/09/2024;5,89;;R$ / litro;VIBRA
SE;ES;SAO MATEUS;POSTO DAMIANI LTDA.; 03.348.196/0001-06;AVENIDA CENTRAL;567;;CARAPINA;29933-210;DIESEL S10;11/09/2024;5,99;;R$ / litro;VIBRA
SE;ES;SERRA;POSTO DE COMBUSTIVEIS OTAVIO EIRELI; 07.470.392/0001-00;AVENIDA ABDO SAAD;833;;JACARAIPE;29173-510;DIESEL;11/09/2024;5,89;;R$ / litro;RAIZEN
SE;ES;SERRA;AUTO SERVICO GASVIX LTDA; 05.684.518/0001-05;RODOVIA BR 101 NORTE;S/N;KM    8,5;CARAPINA GRANDE;29160-042;GNV;09/09/2024;4,95;;R$ / m³;VIBRA
SE;ES;SERRA;AUTO SERVICO GASVIX LTDA; 05.684.518/0001-05;RODOVIA BR 101 NORTE;S/N;KM    8,5;CARAPINA GRANDE;29160-042;DIESEL S10;09/09/2024;6,19;;R$ / litro;VIBRA
SE;ES;SERRA;AUTO POSTO SAO BENEDITO LTDA.; 05.757.150/0001-68;RUA FLORIANO PEIXOTO;104;;SAO JUDAS TADEU;29177-008;DIESEL S10;11/09/2024;6,25;;R$ / litro;BRANCA
SE;ES;SERRA;GEGEL AUTO POSTO LTDA; 05.738.923/0001-69;AVENIDA CENTRAL B;S/N;QUADRAEC VII;CIVIT II;29168-071;DIESEL;10/09/2024;6,29;;R$ / litro;RAIZEN
SE;ES;SERRA;POSTO CANOA DERIVADOS DE PETROLEO LTDA; 05.393.247/0001-39;AVENIDA BRASILIA;575;;PORTO CANOA;29168-600;DIESEL S10;11/09/2024;5,89;;R$ / litro;ALE
SE;ES;SERRA;AUTO POSTO WAVE LTDA; 04.361.389/0001-51;AVENIDA TALMA RODRIGUES RIBEIRO;5416 A;;PORTAL DE JACARAIPE;29173-795;DIESEL;10/09/2024;5,79;;R$ / litro;ALE
SE;ES;SERRA;AUTO POSTO WAVE LTDA; 04.361.389/0001-51;AVENIDA TALMA RODRIGUES RIBEIRO;5416 A;;PORTAL DE JACARAIPE;29173-795;DIESEL S10;10/09/2024;5,89;;R$ / litro;ALE
