Regiao - Sigla;Estado - Sigla;Municipio;Revenda;CNPJ da Revenda;Nome da Rua;Numero Rua;Complemento;Bairro;Cep;Produto;Data da Coleta;Valor de Venda;Valor de Compra;Unidade de Medida;Bandeira
NE;PE;PETROLINA;DELTA COMERCIO DE DERIVADOS DE PETROLEO LTDA; 16.515.054/0001-20;AVENIDA CEL. ANTONIO HONORATO VIANA;79;;GERCINO COELHO;56308-000;DIESEL S10;12/09/2024;5,99;;R$ / litro;RAIZEN
SE;SP;ITAPOLIS;AUTO POSTO E CONVENIENCIA BHX LTDA; 04.464.161/0001-97;RUA JOSE ROSSI;685;;CENTRO;14900-000;DIESEL;12/09/2024;5,79;;R$ / litro;BRANCA
SE;SP;ITAPOLIS;AUTO POSTO E CONVENIENCIA BHX LTDA; 04.464.161/0001-97;RUA JOSE ROSSI;685;;CENTRO;14900-000;DIESEL S10;12/09/2024;5,79;;R$ / litro;BRANCA
NE;BA;CAETITE;AUTO POSTO SAMAPE EIRELI; 15.364.302/0001-16;AVENIDA OLIMAR OLIVEIRA RODRIGUES;365;;OVIDIO TEIXEIRA;46400-000;DIESEL;11/09/2024;6,55;;R$ / litro;BRANCA
NE;BA;CAETITE;AUTO POSTO SAMAPE EIRELI; 15.364.302/0001-16;AVENIDA OLIMAR OLIVEIRA RODRIGUES;365;;OVIDIO TEIXEIRA;46400-000;DIESEL S10;11/09/2024;6,65;;R$ / litro;BRANCA
NE;PB;JOAO PESSOA;BC COMERCIO DE COMBUSTIVEIS LTDA; 06.860.094/0001-55;AVENIDA PRIMEIRO DE MAIO;459;;JAGUARIBE;58015-430;DIESEL;09/09/2024;5,59;;R$ / litro;BRANCA
NE;SE;ITABAIANA;AUTO POSTO M & M LTDA; 15.581.809/0001-21;AVENIDA DR. AIRTON TELES;5;;CENTRO;49500-001;DIESEL S10;09/09/2024;5,88;;R$ / litro;VIBRA
SE;MG;PATROCINIO;AUTO POSTO LH MALAGOLI LTDA; 16.482.525/0001-40;AVENIDA ALTINO GUIMARAES;428;;SAO VICENTE;38740-001;DIESEL;10/09/2024;5,95;;R$ / litro;BRANCA
SE;RJ;BELFORD ROXO;AUTO POSTO SAO JORGE DE BELFORD ROXO LTDA; 15.479.797/0001-29;AVENIDA BENJAMIM PINTO DIAS;1131;;BELFORDROXO;26130-000;GNV;10/09/2024;4,77;;R$ / m³;BRANCA
SE;SP;CATANDUVA;AUTO POSTO VIA MINAS LTDA; 15.116.582/0001-43;RUA MINAS GERAIS;1465;;VILA RODRIGUES;15801-280;DIESEL S10;09/09/2024;5,97;;R$ / litro;BRANCA
CO;MT;SORRISO;JABER COMERCIO DE COMBUSTIVEIS LTDA; 16.845.329/0001-93;RUA ALENCAR BORTOLANZA;730;;INDUSTRIAL 1 ETAPA;78890-000;DIESEL;13/09/2024;6,09;;R$ / litro;BRANCA
S;RS;CANOAS;POSTO DE COMBUSTIVEIS JARDIM DO LAGO LTDA; 15.648.319/0001-03;AVENIDA FARROUPILHA;4432;QUADRA06                  LOTE  14/15;MARECHAL RONDON;92020-475;DIESEL S10;09/09/2024;6,29;;R$ / litro;BRANCA
SE;SP;MOGI DAS CRUZES;AUTO POSTO SUZANO-MOGI LTDA; 15.187.623/0001-92;AVENIDA LOURENCO DE SOUZA FRANCO;2377;;JUNDIAPEBA;08750-560;DIESEL;11/09/2024;6,55;;R$ / litro;BRANCA
SE;SP;MOGI DAS CRUZES;AUTO POSTO SUZANO-MOGI LTDA; 15.187.623/0001-92;AVENIDA LOURENCO DE SOUZA FRANCO;2377;;JUNDIAPEBA;08750-560;DIESEL S10;11/09/2024;6,59;;R$ / litro;BRANCA
SE;MG;CORONEL FABRICIANO;COMERCIAL DE COMBUSTIVEIS VAM LTDA; 14.963.238/0001-27;AVENIDA PRESIDENTE TANCREDO DE ALMEIDA NEVES;792;;TODOS OS SANTOS;35170-054;DIESEL;11/09/2024;5,79;;R$ / litro;ALE
SE;MG;CORONEL FABRICIANO;COMERCIAL DE COMBUSTIVEIS VAM LTDA; 14.963.238/0001-27;AVENIDA PRESIDENTE TANCREDO DE ALMEIDA NEVES;792;;TODOS OS SANTOS;35170-054;DIESEL S10;11/09/2024;5,89;;R$ / litro;ALE
S;RS;LAJEADO;POSTO DE COMBUSTIVEIS MOINHOS LAJEADO LTDA; 15.705.425/0001-73;RUA CARLOS SPHOR FILHO;1520;;MOINHOS;95901-034;DIESEL;11/09/2024;5,78;;R$ / litro;CHARRUA
S;RS;LAJEADO;POSTO DE COMBUSTIVEIS MOINHOS LAJEADO LTDA; 15.705.425/0001-73;RUA CARLOS SPHOR FILHO;1520;;MOINHOS;95901-034;DIESEL S10;11/09/2024;5,81;;R$ / litro;CHARRUA
S;RS;SANTA CRUZ DO SUL;POSTO SHOPPING CAR COMBUSTIVEIS LTDA.; 00.121.811/0006-55;RUA CORONEL OSCAR RAFAEL JOST;2752;;AVENIDA;96815-010;DIESEL;11/09/2024;6,27;;R$ / litro;IPIRANGA
S;RS;SANTA CRUZ DO SUL;POSTO SHOPPING CAR COMBUSTIVEIS LTDA.; 00.121.811/0006-55;RUA CORONEL OSCAR RAFAEL JOST;2752;;AVENIDA;96815-010;DIESEL S10;11/09/2024;6,31;;R$ / litro;IPIRANGA
SE;SP;ITANHAEM;AUTO POSTO VILA SAO PAULO EIRELI; 08.425.042/0001-86;RUA JOAO MARIANO FERREIRA;355;;CIDADE ANCHIETA;11740-000;DIESEL S10;11/09/2024;5,69;;R$ / litro;IPIRANGA
SE;SP;SAO CAETANO DO SUL;AUTO POSTO ALETONI LTDA; 17.009.761/0001-07;AVENIDA GUIDO ALIBERTI;2949;;JARDIM SAO CAETANO;09521-040;DIESEL S10;11/09/2024;6,59;;R$ / litro;VIBRA
NE;PI;PIRIPIRI;POSTO PIRIPIRI LTDA; 14.577.380/0001-36;AVENIDA ADERSON FERREIRA;2390;;RUSSINHA;64260-000;DIESEL;10/09/2024;6,15;;R$ / litro;BRANCA
NE;PI;PIRIPIRI;POSTO PIRIPIRI LTDA; 14.577.380/0001-36;AVENIDA ADERSON FERREIRA;2390;;RUSSINHA;64260-000;DIESEL S10;10/09/2024;6,29;;R$ / litro;BRANCA
NE;RN;NATAL;LM DANTAS REVENDEDORA DE COMBUSTIVEL LTDA; 14.851.845/0001-03;AVENIDA DUQUE DE CAIXAS;39;;RIBEIRA;59012-200;DIESEL;10/09/2024;5,69;;R$ / litro;BRANCA
NE;RN;NATAL;LM DANTAS REVENDEDORA DE COMBUSTIVEL LTDA; 14.851.845/0001-03;AVENIDA DUQUE DE CAIXAS;39;;RIBEIRA;59012-200;DIESEL S10;10/09/2024;5,79;;R$ / litro;BRANCA
S;RS;SAO LUIZ GONZAGA;SLG - COMERCIO DE COMBUSTIVEIS MILENIUM LTDA; 17.188.823/0001-95;RUA SAO JOAO;2670;;MONSENHOR WOLSKI;97800-000;DIESEL;09/09/2024;6,14;;R$ / litro;RODOIL
S;RS;SAO LUIZ GONZAGA;SLG - COMERCIO DE COMBUSTIVEIS MILENIUM LTDA; 17.188.823/0001-95;RUA SAO JOAO;2670;;MONSENHOR WOLSKI;97800-000;DIESEL S10;09/09/2024;6,24;;R$ / litro;RODOIL
N;AM;MANAUS;FE COMERCIO DE COMBUSTIVEIS E DERIVADOS DE PETROLEO LTDA; 08.219.844/0003-00;AVENIDA GOVERNADOR JOSE LINDOSO;3588;LOTEAMENTO NASCENTE DAS AGUAS CLARAS;NOVO ALEIXO;69058-830;DIESEL;09/09/2024;6,39;;R$ / litro;ATEM' S
N;AM;MANAUS;FE COMERCIO DE COMBUSTIVEIS E DERIVADOS DE PETROLEO LTDA; 08.219.844/0003-00;AVENIDA GOVERNADOR JOSE LINDOSO;3588;LOTEAMENTO NASCENTE DAS AGUAS CLARAS;NOVO ALEIXO;69058-830;DIESEL S10;09/09/2024;6,39;;R$ / litro;ATEM' S
SE;RJ;RIO BONITO;ESPERANCA AUTO POSTO SERVICO DE COMBUSTIVEIS LTDA; 15.031.348/0001-13;RUA GERALDINO VIEIRA DE MORAES;S/N;;BOA ESPERANCA;28800-000;DIESEL;11/09/2024;5,99;;R$ / litro;RAIZEN
SE;RJ;RIO BONITO;ESPERANCA AUTO POSTO SERVICO DE COMBUSTIVEIS LTDA; 15.031.348/0001-13;RUA GERALDINO VIEIRA DE MORAES;S/N;;BOA ESPERANCA;28800-000;DIESEL S10;11/09/2024;6,09;;R$ / litro;RAIZEN
SE;SP;ARACATUBA;POSTO J3 ARACATUBA LTDA; 17.294.358/0001-77;AVENIDA DOS ARACAS;1400;;CENTRO;16010-285;DIESEL S10;11/09/2024;6,29;;R$ / litro;BRANCA
S;RS;SANTANA DO LIVRAMENTO;DE SOUZA STAEVIE & CIA. LTDA.; 14.742.132/0001-01;AVENIDA ALMIRANTE TAMANDARE;1915;;CENTRO;97573-531;DIESEL;09/09/2024;6,34;;R$ / litro;IPIRANGA
S;RS;SANTANA DO LIVRAMENTO;DE SOUZA STAEVIE & CIA. LTDA.; 14.742.132/0001-01;AVENIDA ALMIRANTE TAMANDARE;1915;;CENTRO;97573-531;DIESEL S10;09/09/2024;6,39;;R$ / litro;IPIRANGA
SE;SP;SAO CAETANO DO SUL;LEANDRINI AL POSTO DE COMBUSTIVEL LTDA; 17.214.465/0001-48;ESTRADA DAS LAGRIMAS;1270;;JD. SAO CAETANO;09581-300;DIESEL S10;11/09/2024;6,69;;R$ / litro;IPIRANGA
CO;GO;CALDAS NOVAS;AUTO POSTO RODMAIS LTDA; 16.579.651/0001-18;AVENIDA CEL.BENTO DE GODOY;20;;SETOR CENTRAL;75690-000;DIESEL;10/09/2024;5,99;;R$ / litro;BRANCA
S;RS;SANTO ANGELO;COMERCIO DE COMBUSTIVEIS MALLMANN & MARTINS LTDA; 16.750.866/0001-50;RUA MARECHAL FLORIANO;1733;SALA  A;CENTRO;98802-650;DIESEL;10/09/2024;6,12;;R$ / litro;CHARRUA
S;RS;SANTO ANGELO;COMERCIO DE COMBUSTIVEIS MALLMANN & MARTINS LTDA; 16.750.866/0001-50;RUA MARECHAL FLORIANO;1733;SALA  A;CENTRO;98802-650;DIESEL S10;10/09/2024;6,19;;R$ / litro;CHARRUA
S;RS;CACHOEIRA DO SUL;COMERCIAL DE COMBUSTIVEIS MINEIRO LTDA; 01.958.174/0004-77;RUA SETE DE SETEMBRO;860;;CENTRO;96508-010;DIESEL S10;10/09/2024;5,89;;R$ / litro;IPIRANGA
SE;SP;BEBEDOURO;AUTO POSTO ESTRELA-D'ALVA DE BEBEDOURO LTDA; 17.340.307/0001-34;RUA RUBIAO JUNIOR;12;;CENTRO;14700-410;DIESEL;11/09/2024;6,09;;R$ / litro;IPIRANGA
SE;SP;SAO JOAO DA BOA VISTA;AUTO POSTO AMAURI REIS LTDA; 15.242.641/0001-20;RUA HENRIQUE CABRAL DE VASCONCELOS;2055;;JARDIM SAO NICOLAU;13876-100;DIESEL;11/09/2024;5,84;;R$ / litro;BRANCA
SE;SP;SAO JOAO DA BOA VISTA;AUTO POSTO AMAURI REIS LTDA; 15.242.641/0001-20;RUA HENRIQUE CABRAL DE VASCONCELOS;2055;;JARDIM SAO NICOLAU;13876-100;DIESEL S10;11/09/2024;5,94;;R$ / litro;BRANCA
NE;PE;OLINDA;247 COMERCIO LTDA; 00.191.498/0014-31;AVENIDA GOVERNADOR CARLOS DE LIMA CAVALCANTI;2935;;CASA CAIADA;53040-000;DIESEL S10;11/09/2024;5,69;;R$ / litro;BRANCA
S;SC;ITAJAI;SIM REDE DE POSTOS LTDA; 07.473.735/0073-56;RODOVIA BR 101;4850-A;KM    116,8;SALSEIROS;88317-000;GNV;09/09/2024;4,99;;R$ / m³;BRANCA
S;SC;ITAJAI;SIM REDE DE POSTOS LTDA; 07.473.735/0073-56;RODOVIA BR 101;4850-A;KM    116,8;SALSEIROS;88317-000;DIESEL;09/09/2024;6,09;;R$ / litro;BRANCA
S;SC;ITAJAI;SIM REDE DE POSTOS LTDA; 07.473.735/0073-56;RODOVIA BR 101;4850-A;KM    116,8;SALSEIROS;88317-000;DIESEL S10;09/09/2024;6,19;;R$ / litro;BRANCA
CO;GO;CATALAO;RODOVIA COMERCIO DE COMBUSTIVEIS E DERIVADOS LTDA; 17.361.190/0001-75;AVENIDA JOSE MARCELINO;1300;QUADRA74                  LOTE  07;NOSSA SENHORA DE FATIMA;75709-015;DIESEL;11/09/2024;5,89;;R$ / litro;IPIRANGA
CO;GO;CATALAO;RODOVIA COMERCIO DE COMBUSTIVEIS E DERIVADOS LTDA; 17.361.190/0001-75;AVENIDA JOSE MARCELINO;1300;QUADRA74                  LOTE  07;NOSSA SENHORA DE FATIMA;75709-015;DIESEL S10;11/09/2024;5,99;;R$ / litro;IPIRANGA
S;SC;ITAJAI;SIM REDE DE POSTOS LTDA; 07.473.735/0072-75;RODOVIA JORGE LACERDA;133-A;KM    0;SALSEIROS;88311-605;DIESEL;09/09/2024;5,94;;R$ / litro;BRANCA
S;SC;ITAJAI;SIM REDE DE POSTOS LTDA; 07.473.735/0072-75;RODOVIA JORGE LACERDA;133-A;KM    0;SALSEIROS;88311-605;DIESEL S10;09/09/2024;6,04;;R$ / litro;BRANCA
NE;BA;BARREIRAS;PB COMÉRCIO DE COMBUSTIVEL PARA VEICULOS AUTOMOTORES LTDA - EPP; 12.366.653/0001-78;AVENIDA JOSE BRAZ DE AZEVEDO;400;;VILA RICA;40805-970;DIESEL;11/09/2024;6,59;;R$ / litro;ALE
NE;BA;BARREIRAS;PB COMÉRCIO DE COMBUSTIVEL PARA VEICULOS AUTOMOTORES LTDA - EPP; 12.366.653/0001-78;AVENIDA JOSE BRAZ DE AZEVEDO;400;;VILA RICA;40805-970;DIESEL S10;11/09/2024;6,69;;R$ / litro;ALE
S;PR;COLOMBO;MIRAGE COMERCIO DE COMBUSTIVEIS LTDA; 14.748.153/0001-26;RUA ALFREDO TOMACHESCHI;50;;GUARAITUBA;83407-330;DIESEL;12/09/2024;5,99;;R$ / litro;IPIRANGA
S;PR;COLOMBO;MIRAGE COMERCIO DE COMBUSTIVEIS LTDA; 14.748.153/0001-26;RUA ALFREDO TOMACHESCHI;50;;GUARAITUBA;83407-330;DIESEL S10;12/09/2024;6,09;;R$ / litro;IPIRANGA
SE;SP;TAUBATE;J. A. S. AUTO POSTO LTDA; 16.903.290/0001-13;PRACA CEL. VITORIANO;110;;CENTRO;12020-020;DIESEL S10;09/09/2024;5,86;;R$ / litro;IPIRANGA
SE;RJ;VOLTA REDONDA;POSTO CONFORTO DE V.R. LTDA; 15.318.810/0001-68;RUA NOSSA SENHORA DA CONCEICAO;87;;CONFORTO;27262-011;GNV;09/09/2024;5,48;;R$ / m³;BRANCA
SE;RJ;VOLTA REDONDA;POSTO CONFORTO DE V.R. LTDA; 15.318.810/0001-68;RUA NOSSA SENHORA DA CONCEICAO;87;;CONFORTO;27262-011;DIESEL S10;09/09/2024;6,17;;R$ / litro;BRANCA
NE;BA;SERRINHA;AVENIDA PRODUTOS DE PETROLEO LTDA; 17.659.273/0001-45;AVENIDA ANTONIO CARLOS MAGALHAES;385;;CENTRO;48700-000;DIESEL S10;11/09/2024;5,81;;R$ / litro;BRANCA
SE;MG;TIMOTEO;POSTO AUTO GIRO 3 TIMOTEO LTDA.; 15.698.354/0001-29;AVENIDA ACESITA;3120;;SAO JOSE;35182-132;DIESEL;12/09/2024;5,79;;R$ / litro;BRANCA
SE;MG;TIMOTEO;POSTO AUTO GIRO 3 TIMOTEO LTDA.; 15.698.354/0001-29;AVENIDA ACESITA;3120;;SAO JOSE;35182-132;DIESEL S10;12/09/2024;5,89;;R$ / litro;BRANCA
S;RS;NOVO HAMBURGO;COMERCIO DE COMBUSTIVEIS MONUMENTO DO SAPATEIRO LTDA; 02.520.251/0001-22;AVENIDA NACOES UNIDAS;1647;;RIO BRANCO;93310-065;DIESEL S10;09/09/2024;5,69;;R$ / litro;BRANCA
NE;MA;BARRA DO CORDA;BARRA DO CORDA COMBUSTIVEIS LTDA.; 15.734.409/0001-09;AVENIDA GOVERNADORA ROSEANA SARNEY;120;;TRESIDELA;65950-000;DIESEL S10;13/09/2024;6,14;;R$ / litro;BRANCA
SE;SP;SERTAOZINHO;AMARELINHA AUTO POSTO LTDA; 15.916.159/0001-28;AVENIDA ALMIR MARIA MIRANDA;691;;JARDIM GRANDE ALIANCA;14161-336;DIESEL;10/09/2024;5,89;;R$ / litro;VIBRA
SE;SP;ITAQUAQUECETUBA;AUTO POSTO ITQ LTDA; 17.827.131/0001-40;ESTRADA SAO PAULO - MOGI;215;;VILA MONTE BELO;08577-000;DIESEL S10;10/09/2024;5,79;;R$ / litro;ALE
NE;MA;CODO;F C OLIVEIRA COMBUSTIVEIS LTDA; 17.600.625/0001-97;AVENIDA SANTOS DUMONT;4100;": B;";SAO SEBASTIAO;65400-000;DIESEL S10;09/09/2024;6,39;;R$ / litro;BRANCA
N;PA;MARABA;DULCIMAR LOPES COIMBRA - ME; 00.475.314/0001-40;RUA  SERVULO BRITO;101;;CIDADE NOVA;68501-580;DIESEL S10;10/09/2024;6,1;;R$ / litro;SABBÁ
NE;RN;MOSSORO;J MENDES REVENDEDORA DE COMBUSTIVEIS E DERIVADOS LTDA; 03.315.118/0009-54;RUA JEREMIAS DA ROCHA;71;;SANTO ANTÔNIO;59611-190;DIESEL;12/09/2024;5,66;;R$ / litro;BRANCA
NE;MA;PRESIDENTE DUTRA;CCL - CAMPOS COMBUSTIVEIS LTDA.; 13.793.792/0001-40;AVENIDA TANCREDO NEVES;1471;;VILA MILITAR;65760-000;DIESEL;10/09/2024;5,98;;R$ / litro;BRANCA
NE;MA;PRESIDENTE DUTRA;CCL - CAMPOS COMBUSTIVEIS LTDA.; 13.793.792/0001-40;AVENIDA TANCREDO NEVES;1471;;VILA MILITAR;65760-000;DIESEL S10;10/09/2024;5,99;;R$ / litro;BRANCA
N;RO;PORTO VELHO;ALPHA CONSTRUCOES EIRELI; 10.310.039/0002-40;AVENIDA DOS IMIGRANTES;4555;;SETOR INDUSTRIAL;76821-063;DIESEL S10;11/09/2024;6,29;;R$ / litro;BRANCA
S;SC;SAO JOSE;MANEZINHO COMERCIO DE COMBUSTIVEIS LTDA; 17.231.878/0001-30;AVENIDA LEOBERTO LEAL;35;;BARREIROS;88117-001;DIESEL S10;11/09/2024;6,09;;R$ / litro;VIBRA
NE;MA;BARRA DO CORDA;POSTO FREE CENTER ALVORADA LTDA; 09.418.503/0002-37;AV. PEDRO AMORIM;1;MARGEM DA BR 226;ALTAMIRA;65950-000;DIESEL;13/09/2024;5,92;;R$ / litro;BRANCA
NE;MA;BARRA DO CORDA;POSTO FREE CENTER ALVORADA LTDA; 09.418.503/0002-37;AV. PEDRO AMORIM;1;MARGEM DA BR 226;ALTAMIRA;65950-000;DIESEL S10;13/09/2024;5,95;;R$ / litro;BRANCA
SE;SP;LIMEIRA;AUTO POSTO RIVIERA INDEPENDENCIA LTDA; 07.261.709/0003-51;AVENIDA MAJOR JOSE LEVY SOBRINHO;1098;;NEREIDE;13486-190;DIESEL S10;12/09/2024;5,59;;R$ / litro;BRANCA
SE;SP;ITANHAEM;AUTO POSTO IPE DE ITANHAEM LTDA; 17.975.208/0001-29;AVENIDA PROFESSOR VICENTE CAETANO LIMA;980;QUADRA001                 LOTE  007;CHACARAS CIBRATEL;11740-000;DIESEL;11/09/2024;5,89;;R$ / litro;BRANCA
NE;PE;SERRA TALHADA;SAO CRISTOVAO COMERCIO DE PRODUTOS DERIVADOS DE PETROLEO LTDA; 17.654.293/0001-23;AVENIDA JOAO GOMES DE LUCENA;3478;"KM: 412 AO; KM: 414;";SAO CRISTOVAO;56909-000;DIESEL S10;11/09/2024;5,99;;R$ / litro;IPIRANGA
SE;RJ;CAMPOS DOS GOYTACAZES;OASIS COMBUSTIVEIS LTDA; 17.305.026/0001-40;RODOVIA BR 101;S/N;KM 80               LOJA  02;IBITIOCA;28120-000;DIESEL;10/09/2024;5,89;;R$ / litro;BRANCA
SE;RJ;CAMPOS DOS GOYTACAZES;OASIS COMBUSTIVEIS LTDA; 17.305.026/0001-40;RODOVIA BR 101;S/N;KM 80               LOJA  02;IBITIOCA;28120-000;DIESEL S10;10/09/2024;5,99;;R$ / litro;BRANCA
NE;BA;ITABUNA;POSTO DE COMBUSTIVEIS RN LTDA; 02.330.362/0001-76;RODOVIA BR 101 - KM 504;S/N;;ODILON;45601-560;DIESEL;12/09/2024;5,65;;R$ / litro;BRANCA
NE;BA;ITABUNA;POSTO DE COMBUSTIVEIS RN LTDA; 02.330.362/0001-76;RODOVIA BR 101 - KM 504;S/N;;ODILON;45601-560;DIESEL S10;12/09/2024;5,78;;R$ / litro;BRANCA
SE;SP;BIRIGUI;POSTO J3 ARACATUBA LTDA; 17.294.358/0002-58;AVENIDA ANTONIO DA SILVA NUNES;2725;;RECANTO VERDE;16201-191;DIESEL;09/09/2024;5,99;;R$ / litro;BRANCA
SE;SP;BIRIGUI;POSTO J3 ARACATUBA LTDA; 17.294.358/0003-39;AVENIDA EUCLIDES MIRAGAIA;3300;;NOVO JARDIM STABILE;16200-000;DIESEL;09/09/2024;6,39;;R$ / litro;BRANCA
SE;SP;BIRIGUI;POSTO J3 ARACATUBA LTDA; 17.294.358/0003-39;AVENIDA EUCLIDES MIRAGAIA;3300;;NOVO JARDIM STABILE;16200-000;DIESEL S10;09/09/2024;6,49;;R$ / litro;BRANCA
S;PR;CASCAVEL;AUTO POSTO PANORAMICO DE CASCAVEL LTDA; 03.970.676/0001-04;RODOVIA BR-467;S/N;KM 110;CANADA;85813-450;DIESEL;09/09/2024;5,89;;R$ / litro;RAIZEN
S;PR;CASCAVEL;AUTO POSTO PANORAMICO DE CASCAVEL LTDA; 03.970.676/0001-04;RODOVIA BR-467;S/N;KM 110;CANADA;85813-450;DIESEL S10;09/09/2024;5,89;;R$ / litro;RAIZEN
CO;MS;TRES LAGOAS;CAMPO VERDE COMERCIO DE COMBUSTIVEIS LTDA; 14.886.193/0001-34;AVENIDA CAPITAO OLINTO MANCINI;3270;;JARDIM ALVORADA;79601-970;DIESEL;13/09/2024;5,95;;R$ / litro;VIBRA
CO;MS;TRES LAGOAS;CAMPO VERDE COMERCIO DE COMBUSTIVEIS LTDA; 14.886.193/0001-34;AVENIDA CAPITAO OLINTO MANCINI;3270;;JARDIM ALVORADA;79601-970;DIESEL S10;13/09/2024;5,97;;R$ / litro;VIBRA
SE;SP;TAUBATE;AUTO POSTO IAVE ROI LTDA; 15.376.321/0001-62;RUA SÃO PEDRO;1870;;BOSQUE DA SAUDE;12082-010;DIESEL;09/09/2024;5,69;;R$ / litro;BRANCA
NE;CE;SOBRAL;PARAISO COMÉRCIO DE VAREJISTA DE COMBUSTIVEIS LTDA; 16.859.959/0001-17;AVENIDA PIMENTEL GOMES;105;;ALTO DA BRASILIA;62114-000;DIESEL S10;12/09/2024;6,19;;R$ / litro;IPIRANGA
S;RS;SANTA CRUZ DO SUL;COMERCIO DE COMBUSTIVEIS DONA CARLOTA LTDA.; 17.364.869/0001-18;RUA HORACIO DA VEIGA;40;;FAXINAL;96840-810;DIESEL;11/09/2024;6,17;;R$ / litro;RODOIL
S;RS;SANTA CRUZ DO SUL;COMERCIO DE COMBUSTIVEIS DONA CARLOTA LTDA.; 17.364.869/0001-18;RUA HORACIO DA VEIGA;40;;FAXINAL;96840-810;DIESEL S10;11/09/2024;6,25;;R$ / litro;RODOIL
SE;SP;JABOTICABAL;AUTO POSTO NOSSA SENHORA APARECIDA DE JABOTICABAL LTDA; 17.898.426/0001-07;AVENIDA JOSE DA COSTA;1255;;APARECIDA;14882-215;DIESEL;09/09/2024;5,88;;R$ / litro;BRANCA
SE;SP;JABOTICABAL;AUTO POSTO NOSSA SENHORA APARECIDA DE JABOTICABAL LTDA; 17.898.426/0001-07;AVENIDA JOSE DA COSTA;1255;;APARECIDA;14882-215;DIESEL S10;09/09/2024;5,89;;R$ / litro;BRANCA
S;PR;GUARAPUAVA;REDE GUAPO DE POSTOS DE COMBUSTIVEL LTDA; 17.569.551/0001-73;RUA QUINZE DE NOVEMBRO;6879;;CENTRO;85010-000;DIESEL S10;11/09/2024;5,49;;R$ / litro;BRANCA
CO;MT;RONDONOPOLIS;AUTO POSTO FERNANDO CORREA DA COSTA LTDA; 15.782.755/0001-62;RUA FERNANDO CORREA DA COSTA;873;;VILA AURORA I PARTE;78740-000;DIESEL;11/09/2024;6,39;;R$ / litro;BRANCA
CO;MT;RONDONOPOLIS;AUTO POSTO FERNANDO CORREA DA COSTA LTDA; 15.782.755/0001-62;RUA FERNANDO CORREA DA COSTA;873;;VILA AURORA I PARTE;78740-000;DIESEL S10;11/09/2024;6,49;;R$ / litro;BRANCA
SE;MG;ITAJUBA;POSTO FLAMBOYANT EIRELI; 15.307.269/0001-92;AVENIDA PADRE LOURENCO;3566;;MORRO GRANDE;37502-710;DIESEL;11/09/2024;5,99;;R$ / litro;VIBRA
SE;MG;ITAJUBA;POSTO FLAMBOYANT EIRELI; 15.307.269/0001-92;AVENIDA PADRE LOURENCO;3566;;MORRO GRANDE;37502-710;DIESEL S10;11/09/2024;6,09;;R$ / litro;VIBRA
SE;SP;LORENA;SETE ESTRELAS COMERCIO DE DERIVADOS DE PETROLEO LTDA; 00.256.893/0034-07;AVENIDA   TARGINO VILELLA NUNES;789;;VILA NUNES;12603-000;DIESEL S10;12/09/2024;5,79;;R$ / litro;BRANCA
N;RO;VILHENA;AUTO POSTO CATARINENSE LTDA; 22.840.706/0004-47;AVENIDA BRIGADEIRO EDUARDO GOMES;192;;JARDIM ELDORADO;76980-002;DIESEL S10;09/09/2024;6,64;;R$ / litro;SABBÁ
S;RS;SAO LEOPOLDO;SPOLIER LOGISTICA LTDA; 03.711.378/0001-91;AVENIDA PAROBE;1811;;SCHARLAU;93140-000;DIESEL;09/09/2024;5,79;;R$ / litro;IPIRANGA
S;RS;SAO LEOPOLDO;SPOLIER LOGISTICA LTDA; 03.711.378/0001-91;AVENIDA PAROBE;1811;;SCHARLAU;93140-000;DIESEL S10;09/09/2024;5,89;;R$ / litro;IPIRANGA
NE;PE;LAJEDO;POSTO JASSE LTDA; 17.423.467/0001-47;AVENIDA PRESIDENTE KENNEDY;481;": A;";CENTRO;55385-000;DIESEL S10;11/09/2024;5,78;;R$ / litro;BRANCA
S;PR;FOZ DO IGUACU;A M COMERCIO DE COMBUSTIVEIS LTDA; 17.328.883/0001-66;RUA MONTEIRO LOBATO;35;;VILA PORTES;85865-180;DIESEL;12/09/2024;6,07;;R$ / litro;IDAZA
S;PR;FOZ DO IGUACU;A M COMERCIO DE COMBUSTIVEIS LTDA; 17.328.883/0001-66;RUA MONTEIRO LOBATO;35;;VILA PORTES;85865-180;DIESEL S10;12/09/2024;6,17;;R$ / litro;IDAZA
SE;MG;UNAI;POSTO CAPIM BRANCO LTDA; 15.727.179/0001-50;RUA CELINA LISBOA FREDERICO;30;;CENTRO;38610-041;DIESEL;13/09/2024;6,15;;R$ / litro;IPIRANGA
SE;MG;UNAI;POSTO CAPIM BRANCO LTDA; 15.727.179/0001-50;RUA CELINA LISBOA FREDERICO;30;;CENTRO;38610-041;DIESEL S10;13/09/2024;6,18;;R$ / litro;IPIRANGA
NE;BA;BARREIRAS;AUREVIS COMERCIO DE COMBUSTIVEIS E TRANSPORTES LTDA; 15.328.857/0001-02;RUA   JESUINO PAMPLONA;371;;OURO BRANCO;47802-370;DIESEL;11/09/2024;6,25;;R$ / litro;BRANCA
NE;BA;BARREIRAS;AUREVIS COMERCIO DE COMBUSTIVEIS E TRANSPORTES LTDA; 15.328.857/0001-02;RUA   JESUINO PAMPLONA;371;;OURO BRANCO;47802-370;DIESEL S10;11/09/2024;6,35;;R$ / litro;BRANCA
SE;MG;POCOS DE CALDAS;AUTO POSTO E CENTRO AUTOMOTIVO WENCESLAU BRAZ LTDA; 17.212.958/0001-49;AVENIDA WENCESLAU BRAZ;2000;;ESTANCIA POCOS DE CALDAS;37706-055;DIESEL;10/09/2024;5,79;;R$ / litro;BRANCA
SE;MG;POCOS DE CALDAS;AUTO POSTO E CENTRO AUTOMOTIVO WENCESLAU BRAZ LTDA; 17.212.958/0001-49;AVENIDA WENCESLAU BRAZ;2000;;ESTANCIA POCOS DE CALDAS;37706-055;DIESEL S10;10/09/2024;5,79;;R$ / litro;BRANCA
N;AM;MANAUS;FORTE COMERCIO DE DERIVADOS DE PETROLEO LTDA; 07.848.998/0003-90;RUA VICENTE DO SALVADOR;406;;CIDADE DE DEUS;69099-870;DIESEL S10;11/09/2024;6,39;;R$ / litro;EQUADOR
N;RO;CACOAL;AUTO POSTO SOBERANO LTDA; 07.219.464/0006-47;AVENIDA DAS COMUNICACOES;2972;;TEIXEIRAO;76965-674;DIESEL;10/09/2024;6,29;;R$ / litro;VIBRA
SE;MG;ARAXA;PEREIRA COMERCIO DE COMBUSTIVEIS LTDA; 17.428.198/0001-01;AVENIDA HITALO ROS;1300;;MORADA DO SOL;38181-419;DIESEL;09/09/2024;5,94;;R$ / litro;BRANCA
SE;MG;ARAXA;PEREIRA COMERCIO DE COMBUSTIVEIS LTDA; 17.428.198/0001-01;AVENIDA HITALO ROS;1300;;MORADA DO SOL;38181-419;DIESEL S10;09/09/2024;5,99;;R$ / litro;BRANCA
N;PA;CASTANHAL;DF COMERCIO DE COMBUSTIVEL LTDA; 17.372.578/0001-71;AVENIDA PRESIDENTE VARGAS;4367;;IANETAMA;68745-000;DIESEL;10/09/2024;5,79;;R$ / litro;VIBRA
N;PA;CASTANHAL;DF COMERCIO DE COMBUSTIVEL LTDA; 17.372.578/0001-71;AVENIDA PRESIDENTE VARGAS;4367;;IANETAMA;68745-000;DIESEL S10;10/09/2024;5,89;;R$ / litro;VIBRA
NE;BA;TEIXEIRA DE FREITAS;PETROTRANS TRANSPORTES QUIMICOS E PETROQUIMICOS LTDA ME.; 12.518.538/0001-71;ROD BR 101;1470;B KM 871;MONTE CASTELO;45995-970;DIESEL;11/09/2024;5,69;;R$ / litro;IPIRANGA
NE;BA;TEIXEIRA DE FREITAS;PETROTRANS TRANSPORTES QUIMICOS E PETROQUIMICOS LTDA ME.; 12.518.538/0001-71;ROD BR 101;1470;B KM 871;MONTE CASTELO;45995-970;DIESEL S10;11/09/2024;5,79;;R$ / litro;IPIRANGA
S;PR;UMUARAMA;POSTO COLONIAL DO PARANA LTDA; 17.533.931/0001-58;AVENIDA LONDRINA;3464;;ZONA II;87502-250;DIESEL S10;11/09/2024;6,44;;R$ / litro;BRANCA
S;PR;GUARAPUAVA;IDEAL GUAPO LTDA; 03.626.094/0013-30;AVENIDA VEREADOR  SERAFIM RIBAS;2222;;BOQUEIRAO;85023-500;DIESEL;10/09/2024;5,43;;R$ / litro;BRANCA
S;PR;GUARAPUAVA;IDEAL GUAPO LTDA; 03.626.094/0013-30;AVENIDA VEREADOR  SERAFIM RIBAS;2222;;BOQUEIRAO;85023-500;DIESEL S10;10/09/2024;5,47;;R$ / litro;BRANCA
SE;RJ;NITEROI;POSTO DE GASOLINA MIDAS DA ALAMEDA LTDA; 15.839.325/0001-30;ALAMEDA SAO BOAVENTURA;170;;FONSECA;24120-196;DIESEL S10;09/09/2024;5,74;;R$ / litro;BRANCA
SE;MG;TRES CORACOES;AUTO POSTO TUPY TRES CORACOES LTDA; 15.110.111/0002-09;AVENIDA DEPUTADO RENATO AZEREDO;1210;;PERO;37410-001;DIESEL;11/09/2024;6,29;;R$ / litro;IPIRANGA
SE;MG;TRES CORACOES;AUTO POSTO TUPY TRES CORACOES LTDA; 15.110.111/0002-09;AVENIDA DEPUTADO RENATO AZEREDO;1210;;PERO;37410-001;DIESEL S10;11/09/2024;6,39;;R$ / litro;IPIRANGA
S;RS;ERECHIM;POSTO PONTUAL COMERCIO DE COMBUSTIVEIS LTDA ME; 18.108.615/0001-00;RUA JOÃO TORMEN;640;;LOTEAMENTO PARQUE DOS IMIGRANTES;99700-000;DIESEL;10/09/2024;5,83;;R$ / litro;BRANCA
S;RS;ERECHIM;POSTO PONTUAL COMERCIO DE COMBUSTIVEIS LTDA ME; 18.108.615/0001-00;RUA JOÃO TORMEN;640;;LOTEAMENTO PARQUE DOS IMIGRANTES;99700-000;DIESEL S10;10/09/2024;5,98;;R$ / litro;BRANCA
NE;PI;PICOS;ARIZONA PETROLEO LTDA; 10.894.760/0001-43;AVENIDA SENADOR HELVÍDIO NUNES;4690;;JUNCO;64600-000;DIESEL;11/09/2024;5,95;;R$ / litro;IPIRANGA
NE;PI;PICOS;ARIZONA PETROLEO LTDA; 10.894.760/0001-43;AVENIDA SENADOR HELVÍDIO NUNES;4690;;JUNCO;64600-000;DIESEL S10;11/09/2024;5,99;;R$ / litro;IPIRANGA
NE;PI;TERESINA;IGUATEMI DISTRIBUIDORA LTDA; 03.072.068/0002-55;AVENIDA DOM SEVERINO;1498;;FATIMA;64049-375;DIESEL S10;11/09/2024;6,09;;R$ / litro;BRANCA
NE;BA;PAULO AFONSO;A. MACHADO DOS SANTOS DERIVADOS DE PETROLEO; 18.005.154/0001-31;RUA PADRE CICERO;874;A;BTN3;48611-030;DIESEL;09/09/2024;6,36;;R$ / litro;BRANCA
NE;BA;PAULO AFONSO;A. MACHADO DOS SANTOS DERIVADOS DE PETROLEO; 18.005.154/0001-31;RUA PADRE CICERO;874;A;BTN3;48611-030;DIESEL S10;09/09/2024;6,46;;R$ / litro;BRANCA
N;RO;PORTO VELHO;CERNOV COMERCIO DE COMBUSTIVEIS LTDA; 13.805.691/0001-42;RUA MARIA DE LOURDES;7165;;ESPERANCA DA COMUNIDADE;76824-308;DIESEL;09/09/2024;6,29;;R$ / litro;BRANCA
N;RO;PORTO VELHO;CERNOV COMERCIO DE COMBUSTIVEIS LTDA; 13.805.691/0001-42;RUA MARIA DE LOURDES;7165;;ESPERANCA DA COMUNIDADE;76824-308;DIESEL S10;09/09/2024;6,34;;R$ / litro;BRANCA
NE;BA;ITABUNA;COMERCIAL DE DERIVADOS DE PETROLEO DA HORA LTDA; 18.500.301/0001-40;AVENIDA INACIO TOSTA FILHO;508;TERREO;CENTRO;45600-201;DIESEL;12/09/2024;5,89;;R$ / litro;RAIZEN
SE;MG;UNAI;POSTO SANTA RITA UNAI EIRELI; 07.760.547/0001-34;RUA JUVENCIO CORREIO;144;;CAPIM BRANCO I;38610-000;DIESEL;13/09/2024;6,14;;R$ / litro;IPIRANGA
SE;MG;UNAI;POSTO SANTA RITA UNAI EIRELI; 07.760.547/0001-34;RUA JUVENCIO CORREIO;144;;CAPIM BRANCO I;38610-000;DIESEL S10;13/09/2024;6,18;;R$ / litro;IPIRANGA
N;TO;PORTO NACIONAL;A. A. VASCONCELOS COMBUSTIVEIS - EIRELI; 15.772.749/0001-24;RUA SERGIPE;S/N;LOTE  11                  QUADRA3-A;NOVO PLANALTO;77500-000;DIESEL S10;11/09/2024;5,85;;R$ / litro;BRANCA
S;RS;ERECHIM;COMÉRCIO DE COMBUSTIVEIS RIEDER EIRELI - ME; 17.364.448/0001-97;RUA ESPIRITO SANTO;590;;CENTRO;99700-000;DIESEL;10/09/2024;6,05;;R$ / litro;VIBRA
S;RS;ERECHIM;COMÉRCIO DE COMBUSTIVEIS RIEDER EIRELI - ME; 17.364.448/0001-97;RUA ESPIRITO SANTO;590;;CENTRO;99700-000;DIESEL S10;10/09/2024;6,09;;R$ / litro;VIBRA
SE;SP;GUARUJA;PRL PETROLEO II LTDA.; 18.018.790/0001-06;AVENIDA PUGLISI;550;;CENTRO;11410-002;DIESEL S10;09/09/2024;6,34;;R$ / litro;VIBRA
NE;MA;BALSAS;GAO COMBUSTIVEIS E LUBRIFICANTES 5000 EIRELI; 18.955.346/0001-09;RUA LEONARDUS PHILIPSEN;780;;SETOR INDUSTRIAL;65800-000;DIESEL;13/09/2024;5,79;;R$ / litro;SABBÁ
NE;MA;BALSAS;GAO COMBUSTIVEIS E LUBRIFICANTES 5000 EIRELI; 18.955.346/0001-09;RUA LEONARDUS PHILIPSEN;780;;SETOR INDUSTRIAL;65800-000;DIESEL S10;13/09/2024;5,81;;R$ / litro;SABBÁ
SE;SP;CRUZEIRO;POSTO 3 ABASTECIMENTO DE COMBUSTIVEIS LTDA; 18.339.634/0001-39;AVENIDA GOVERNADOR JANIO QUADROS;389;;DOUTOR JOAO BATISTA;12720-000;DIESEL S10;12/09/2024;5,99;;R$ / litro;BRANCA
N;AP;SANTANA;MONTE & FILHOS LTDA; 14.572.838/0003-26;RODOVIA DUCA SERRA;7000;;DISTRITO INDUSTRIAL;68929-500;DIESEL;12/09/2024;6,61;;R$ / litro;BRANCA
N;AP;SANTANA;MONTE & FILHOS LTDA; 14.572.838/0003-26;RODOVIA DUCA SERRA;7000;;DISTRITO INDUSTRIAL;68929-500;DIESEL S10;12/09/2024;6,69;;R$ / litro;BRANCA
SE;MG;SABARA;AUTO POSTO TREVINHO LTDA; 17.960.090/0001-65;AVENIDA JOSE CANDIDO DA SILVEIRA;3252;;ANA LUCIA;34710-138;GNV;11/09/2024;4,99;;R$ / m³;VIBRA
NE;BA;JUAZEIRO;FUTURO DERIVADOS DE PETROLEO LTDA; 18.711.930/0001-19;AVENIDA JOAO DURVAL CARNEIRO;1;;JOAO XXIII;48900-300;DIESEL;11/09/2024;6;;R$ / litro;BRANCA
